Member ID,Date,Review,Student Review,Campus/Facilities,Club/Societies,Careers Service,Wifi/Internet
467090,12th March 22,The medicine cause is too PBL-based. I personally prefer the traditional lecture-based approach.,4,5,4,3,5
1167089,10th March 22,"Great teaching and such amazing views being surrounded by the countryside, there’s also so much to do in Exeter",4.2,4,4,4,5
1367052,10th March 22,There are a lot of places to you could study and also have a bit of fun. Love the atmosphere here,4.2,5,5,5,2
567048,10th March 22,Good place to study for postgrads,4.4,5,4,4,5
867045,10th March 22,Fantastic university - love my course and the facilities.,5,5,5,5,5
1067046,9th March 22,Really good university to be in,5,5,5,5,5
967039,9th March 22,"Lovely campus, with everything you need, and a brilliant university to be a part of",4,5,4,3,4
867038,9th March 22,"A good experience all round. Given the amount of hills, I certainly don't have to stress about leg day at the gym as much as I once did!",3.8,4,4,4,4
567037,9th March 22,"University of Exeter is like a dream come true, perfect student town for a student to be focused towards their work and also enjoy their student life. great career zone to help find employment.",5,5,5,5,5
467033,9th March 22,"Good University, the campus is really local to city centre and loads of facilities at campus",3.6,4,4,3,4
967029,9th March 22,"Exeter is a great university I feel it offers the full university experience: good range of challenging courses, many societies for almost anything you can think of, good campus facilities e.t.c
The only issues I have had have been with timetabling consistently each term giving me classes that overlap. Considering the amount we pay I would at least like to be able to attend my classes! Though this is more an issue with the people in timetabling rather than the university itself I thought it worth mentioning.
Other than that I have had an excellent time at Exeter and really engaged with some wonderful classes and lecturers.",3.8,4,4,3,4
1367020,9th March 22,High quality academic and social experience,5,5,5,5,5
867013,9th March 22,"Great Uni, loved my three years there. Would recommend!",5,5,5,5,5
1267012,9th March 22,The uni is great! So helpful and facilities are great! I do not like all the hills on campus though,4.4,4,5,5,5
1367005,9th March 22,The university offers modern campus facilities and plenty of conveniences.,3,3,3,3,3
767002,8th March 22,It can be a little tricky to get used to.,4,5,4,4,3
667000,8th March 22,Exeter uni is nice as they have so many societies and the professors are so kind as they always reply students email really fast and keen to answer students questions.,3.6,4,5,3,3
566976,8th March 22,Exeter university has a great campus. The teaching staff are really good and the facilities on campus are good as well.,4.2,5,4,4,4
466944,8th March 22,Brilliant place to study and get your degree. Beautiful campus and great facilities.,3.2,4,4,3,1
466938,8th March 22,It is a good university with the good career sevice and facilities. I did not join any clubs so I do not know how it is.,4.6,5,4,5,5
666935,7th March 22,A wonderful university environment,5,5,5,5,5
1266934,7th March 22,A good university with a various amount of facilities available.,3.4,4,3,3,4
1166639,7th March 22,"Good experience, good facilities",5,5,5,5,5
466570,7th March 22,Amazing uni overall with great services,4.8,5,4,5,5
966512,7th March 22,"Great uni, nice societies , good lecturers",4.4,5,5,4,5
966368,23rd February 22,Great university with lots of facilities. It is a Russell Group after all,5,5,5,5,5
1066344,22nd February 22,A good university contains lots of service and help to student. Really can learn a lot in this university.,5,5,5,5,5
766327,18th February 22,"I've been living at Carrick View since September and have felt welcomed, supported, and at home the entire time! My room has really been thought out from a student perspective, which makes studying and living here easy and stress free. It's lovely and quiet where I am in the building, and all the staff are super friendly as well.",5,5,5,5,5
1166319,14th February 22,"I love studying at Exeter. The perfect mix of fun, societies and clubs with a really high level education. I study business and french and have found the lecturers are seminar leaders to be mostly very helpful and attentive. Unlike a lot of universities, as a campus university it is so easy to socialise and make friends as everyone is on campus. I only have one online lecture a week which is incredible in comparison to my friends in bigger unis like Leeds or Bristol who have barely met their course mates as their lectures are almost entirely online. It is such a sociable uni and so easy to meet lots of people, and the stereotypes of people in Exeter are mostly untrue in my opinion. There are a lot of Surrey people here tho. I initially thought that the campus being further away from city would be an issue, but it is literally a ten minute walk. Unlike most other unis, all the main first year acoms are less than a fifteen min walk from campus and the same distance from town.",4.2,5,5,3,5
666312,13th February 22,The university offers rich resources for a good understanding of the subjects. The faculties are supportive and the state of the art facilities for class and seminars are of remarkable standards.,4.4,5,5,4,5
566309,12th February 22,"Love it, on st lukes campus and it’s a really nice environment to be around.",4.2,4,5,4,4
766307,12th February 22,so good i love it so much its so amazing,5,5,5,5,5
566302,11th February 22,"Nothing particularly to complain about, maybe the lectures are a bit too early in the morning for me to come consistently to, but I guess that's on me.",4.6,5,5,4,5
1266299,11th February 22,really beautiful campus with modern facilities,5,5,5,5,5
1166252,11th February 22,"I don't have a lot to say; Exeter is a reasonably good school but I do feel like it lacks a bit diversity, and I don't feel too included as an international student.",2.8,4,3,2,2
466220,11th February 22,Really modern facilities and lots of clubs and societies to get involved with. A very comfortable place to be,4.2,4,5,4,5
666187,11th February 22,"I love being in Exeter, the university is perfect for me, the facilities are great nothing to complain about really. Also the socials are a great way to meet people.",4.4,5,4,4,5
966149,11th February 22,"To talk about the university, an amazing university I have ever come across. This might sound silly but when I got the list of universities to shortlist them I don’t know why but all of a sudden after reading the name university of exeter I decided the I will be going to this particular university itself. And now I think I made a best choice. The campus is amazing, the faculties are like a best friends to us, they just don’t teach also they provide us all the sources. Campus is fully packed with events and other activities every now and then. There always something to learn from the campus. I m glad enough that I chose this university for my masters❤️",5,5,5,5,5
1365814,10th February 22,"As a Drama student, I am not often required to visit the campus. But, from the times that I have been there, my experience has been great.",4.2,4,5,4,4
465750,10th February 22,"Lovely campus, lovely people. Really nice modern feel to it. Huge campus, really green. Course is great. Lecturers really good",3.6,5,3,3,4
865382,9th February 22,"Good facilities and lecturers, need more accommodation on campus though",3.6,4,3,4,4
665364,31st January 22,"The campus is very green, and a beautiful place to work. There are outstanding facilities in each department and a staff that are clearly striving for the best in every student.",4.6,5,5,5,4
1165333,28th January 22,Love the greenish surroundings of the uni.,3.4,4,3,4,3
1065324,13th January 22,"The University's social side is thriving, many clubs and societies to join, many study spaces are full to the brim on campus, the library including! The study spaces are great to work in, ample opportunity to be comfortable at your own desk with a view. Although, a downfall is that the internet connection requires a password which you have to go to IT to find out, otherwise you will be logging into the wifi system every 20-40 minutes which is quite annoying. The Careers Service is great in offering lots of opportunities for talks and events to attend about CV writing and cover letter, but a little more help on one to one meetings talking about applications wouldn't go un-appreciated. Altogether however a lovely University that is supportive and thriving with opportunity.",4,5,5,4,3
1365321,12th January 22,very amazing I am dying from opportunity to study there,5,5,5,5,5
1365320,11th January 22,A good place for masters in data science,5,5,5,5,5
665319,11th January 22,Absolutely love the uni I’m at - so glad I came here as it’s been the best two years so far.,5,5,5,5,5
665317,11th January 22,"The university is mainly great, with good facilities",5,5,5,5,5
565253,11th January 22,"Good rugby, unfortunately on the top of a hill.",3.8,4,4,3,5
865062,11th January 22,"A good uni to study at, a good range of courses as well",4.6,5,4,5,5
965054,11th January 22,Great University amazing campus. Great facilities,5,5,5,5,5
1265047,7th January 22,the University is great the Societys are great,5,5,5,5,5
765033,19th December 21,"It’s good, I do physics and am part of the rugby society. There’s a lot of work in physics but manageable.",4.4,5,4,5,3
964087,18th December 21,"Beautiful campus where there is always something to do, whether it be listening to the grand piano playing in the forum or taking part in a society event. High standard of teaching and great 1:1 support when needed.",4.4,5,5,4,4
1064037,17th December 21,"Ok, nothing special. Nice campus but other than than nightlife is poor and academically it’s on the decline as they don’t have any projects for the future.",3.2,3,4,2,4
564038,16th December 21,No SU so after a sports game there isn’t really anywhere to go,3.6,3,5,4,4
1163831,22nd November 21,"I can't be bothered to right a full review right now , but overall nice campus and good uni",4.4,5,4,4,5
563545,19th November 21,I love going to uni here I find that the WiFi can be very slow at times,3.6,4,4,3,3
863464,19th November 21,"Great uni with nice campus, knowledgeable lecturers",4.4,5,5,4,5
1062990,14th November 21,Very nice main campus with plenty of plants and greenery. Bit hilly,4,4,5,4,3
862870,5th November 21,It’s a pain to get up the hill for every lesson and the location of it means that it’s a decent walk to get to the high street. At least they have buses,3.2,3,4,3,3
662871,3rd November 21,a good place to study here..........,4.4,5,5,4,4
321234,19th October 21,"Great lecturers, lots of study spaces available.",4.4,4,5,4,5
1062678,18th October 21,"a gorgeous campus centred just north of the main city centre, which in itself is big enough to stay interesting, but small enough to feel a part of the community and a sense of belonging. A 20 minute train to the coast is something not to be taken for granted either",4.2,5,4,4,4
962676,14th October 21,Very good - involves everyone and lots of societies to get involved with,5,5,5,5,5
562672,14th October 21,"There’s a reason why it’s one of the best! Amazing facilities, the greenery in Streatham is truly amazing.",3.8,5,4,4,3
862654,7th October 21,Very green university with lots of facilities.,5,5,5,5,5
861694,6th October 21,"Haven’t had too much experience on campus because of covid, but seems okay",3.2,4,3,3,3
661518,6th October 21,"Amazing campus, great teachers and good studying atmosphere",5,5,5,5,5
960330,5th October 21,I would highly recommend choosing the university of Exeter.,4.8,5,5,4,5
860177,5th October 21,Good uni with a lot of socials and clubs,4.8,5,5,5,4
560174,24th September 21,"The taught part of my course doesn't start before Monday, 27th September. So far, my experience with SID and Students' Union has been great and I look forward to meeting people on my course on Monday.",3.6,3,4,4,3
1160169,13th August 21,Good uni :) care for their students,3.8,5,4,2,4
1260082,2nd August 21,Despite COVID circumstances I enjoyed my time at the University of Exeter.,5,5,5,5,5
959960,19th June 21,It's a good university but covid has caused the facilities to decrease.,3.8,5,4,3,4
1159798,16th June 21,"Love everything about Exeter university. Professors, career fairs, societies..everything was on high standards",5,5,5,5,5
659794,16th June 21,Amazing Uni with a beautiful campus. Facilities available are excellent with town being only a walk away! Teaching is very professional with helpful staff!,5,5,5,5,5
1359795,16th June 21,"I had a great three years at Exeter. Although there is room for improvement in the careers services, they were always proactive towards and responsive to student needs.",4.8,5,5,4,5
458488,14th June 21,Excellent University facilities with great support from staff. More could have been done to support students grades throughout Covid however.,4,5,4,3,4
1159158,11th June 21,Very good staff and faculty on campus.,5,5,5,5,5
459139,9th June 21,Great Uni facilities are great,4,4,4,4,4
1159015,9th June 21,Uni has been good online this year. The teaching was delivered very nicely. There are many opportunities and things to do at Exeter.,4.2,5,4,4,4
859001,9th June 21,I think uni has been good online this year,5,5,5,5,5
858470,30th May 21,The lecturers from Exeter have helped me throughout my degree - always there to listen and give good advice,5,5,5,5,5
1358414,28th May 21,Great place to stay whilst at uni. Clean and comfortable!,5,5,5,5,5
858243,28th May 21,Haven’t been here much due to the restrictions that were put in place however from the handful of times I’ve been here I’ve had a positive experience,4,5,4,4,4
758205,27th May 21,"Really enjoyable expereince, the university has tried to provide everything at the same quality",4,4,4,4,4
958177,27th May 21,"I regret coming to this university very much. It lacks sufficient support and usually does not provide advice, but only follows the rules and procedures. Students have no chance to be guided to visit the campus in a deeper way. Even so, tuition fees have not been reduced.",4.8,5,4,5,5
1358048,21st May 21,Great university with a very nice campus!,5,5,5,5,5
958047,20th May 21,"Nice campus facilities, great clubs and societies!",5,5,5,5,5
1157988,19th May 21,"The university has a grand campus, with many stores near it. In a central location therefore everything is walking distance.",5,5,5,5,5
657802,19th May 21,Best university for research! Especially lovely green campuses.,4.2,5,4,4,4
957801,18th May 21,Excellent campus in the United Kingdom,5,5,5,5,5
657776,17th May 21,"Good first year, looking forward to the rest.",5,5,5,5,5
457730,17th May 21,Very clean and well-kept university with so many spaces to sit and study etc,4.6,5,5,5,4
1357707,17th May 21,"best experience , helpful staff great resources",5,5,5,5,5
1357705,14th May 21,"University of Exeter has met expectations I did not even have before. Half of the lecturers for my course (Sports and Exercise Medical Science) were very knowledgable.
The St Luke and Streatham campuses are not too far from the city centre.
I enjoyed the societies (Muay Thai and Jiu-Jitsu). They allowed me to meet people from different backgrounds.
My only complaint is the University Community Mental Health Team. I had 5 sessions with them for my Mixed Anxiety and Depressive Disorder. It was very unhelpful as the nurse was always unprepared and seemingly inattentive.",5,5,5,5,5
857703,13th May 21,"I love St Luke’s Campus- it has a great feeling to it, a fantastic study space!",4.8,5,5,5,5
457701,13th May 21,"I enjoyed the University of Exeter very much! The campus is beautiful, the people are very friendly and helpful.",4.8,5,5,5,4
557684,13th May 21,"Great place, great university.",5,5,5,5,5
1357618,13th May 21,"I was studying remotely, so no experience at all from campus .",3,3,3,3,3
657613,13th May 21,"The campus is stunning, and the teachers are very gentle. Although there is no way to teach offline, I still had a good time.",4.2,5,4,4,4
1057606,13th May 21,Outstanding education. Can stay connected via social media.,5,5,5,5,5
1157601,13th May 21,"Fantastic University, courses are great and couldn't recommend more.",5,5,5,5,5
1357596,12th May 21,Very good university with excellent campus,5,5,5,5,5
1057590,11th May 21,Has been good but COVID has prevented me from having a proper experience.,4,5,3,4,4
1357562,11th May 21,The University of Exeter is great and the lectures are very approachable. The facilities are good.,4.8,5,5,5,4
1157558,11th May 21,They don’t teach very well as I expected. Lots of self learning required.,3.2,3,3,3,4
1157556,11th May 21,"Good University, Clean and lots of spaces to study and be social.",4.4,5,4,4,5
657497,11th May 21,Covid meant that I didn't really spend much time on Campus,4.2,5,4,4,4
1157424,11th May 21,"Hard to give a full review as have only been on campus a handful of times, however careers team have been very useful so far regarding industrial placements.",4.4,5,4,5,4
1257199,11th May 21,"University of Exeter is an amazing university! The staff are extremely supportive, and I am enjoying the course!",5,5,5,5,5
1357054,10th May 21,haven’t had much experience on campus as everything is online and security is tough,3,4,1,3,4
456847,10th May 21,"My experience at Exeter has been great so far! I have no complaints, I haven’t experienced it to the fullest extent due to COVID but despite this I have still really enjoyed my first year",4,4,4,4,4
556788,10th May 21,Because of COVID I have barely been on campus this year. The times I have been there it has been fine but the only reason I have been going to campus this year was for sports.,3.2,3,4,3,3
1356770,8th May 21,Enjoyed it and the campus is beautiful. The teaching is generally good but covid was terribleformy student experience.,3.6,4,4,3,4
1356758,7th May 21,Location is great and convenient,5,5,5,5,5
1156741,30th April 21,Really lovely campus and great clubs however I haven’t really used the careers services but can’t say they are very helpful,3.4,4,4,2,4
1256681,28th April 21,The best uni experience I could ask for!,5,5,5,5,5
656669,24th April 21,"Till now, I've not experenced many campus life due to the lockdown.",4.6,5,4,5,5
656639,23rd April 21,"Since I arrived on my first open day, the campus was a big selling point. I feel at home there and just has a friendly vibe",3.8,5,4,3,4
556643,23rd April 21,"offers a lot of facilities, could improve it's internet connection and projectors( really bad projectors)",2.8,3,3,3,2
456606,22nd April 21,I am happy to be a student at university of Exeter,4.6,5,5,5,4
656602,22nd April 21,Good university but there never seems enough space on campus which can be frustrating. WiFi is good but will keep cutting off. There are over 200 socities to choose from which is nice,3,3,4,3,2
556599,22nd April 21,Good teaching quality and management during lockdown,4,4,4,4,4
956546,21st April 21,"The location of the university is far away from the city, which is very suitable for study. The teachers and staff are friendly and helpful, and the school facilities are complete.",4,4,4,4,4
1156540,21st April 21,"I’ve enjoyed my time at Exeter. Excellent facilities and responsive careers service. Lots of variety in societies and good internet across campus. COVID put a dampener on the societies, but that’s not the unis fault. I have never really interacted with the union but I hear they are ok.",3.6,5,3,4,4
456460,21st April 21,I love my school so much! I like every class! My life here is more perfect than I ever imagined!,5,5,5,5,5
1056395,21st April 21,Not the university experience I was expecting because of Covid. Would say the university is average. Could improve on student relations and communication. Often seems that the university management is out of touch with the student base.,3.4,4,4,3,3
656324,21st April 21,It’s a pretty campus and you get a nice walk to the campus,3.4,4,3,3,4
955354,20th April 21,"The university is great, the campus is beautiful",4,5,4,4,5
1255344,20th April 21,Staffs are helpful. There will be a regular update from uni or from student guild so you will know what is happening or what happen next. Various societies hold loads of events. So definitely will enjoy the uni life here.,5,5,5,5,5
1355343,20th April 21,University of exeter - great support for well-being,3.6,4,4,3,4
1155328,19th April 21,"A perfect school, excellent teachers, allows students to learn a lot. Beautiful natural environment makes people happy.",4.8,5,4,5,5
555314,19th April 21,"Nice services, good equipments, nice environment",5,5,5,5,5
555313,16th April 21,Great higher education experience with friends from around the world and well-rounded scholars/professors,3.8,4,3,4,4
655312,15th April 21,"Had such a great time studying in Exeter, meeting great people and getting to study at a brilliant university!",5,5,5,5,5
1255303,15th April 21,Evething is supberb and above expectation!!,5,5,5,5,5
855240,17th March 21,"It’s a good uni, however Exeter as a place is smaller than a lot of cities. If you like the vibe of seeing people you know often, it’s good. Close to beaches too.",4.2,4,4,4,5
1155232,17th March 21,This University is really beautiful and I like that it’s close to the city and lots of shops. There are lots of courses available to students which means there is a course for everyone,5,5,5,5,5
455231,17th March 21,"Love the societies and it’s just a lot of fun, very happy with my choice",5,5,5,5,5
755074,17th March 21,Absolutely excellent university,5,5,5,5,5
1154967,17th March 21,It’s a great university with great facilities.,3.4,4,3,3,4
854912,17th March 21,"Lovely campus and facilities. Due to covid this year, I have been unable to use much of it but am excited to do so in the future!",3.8,4,4,3,4
1254727,17th March 21,Many support during COVID. The university offers free COVID test for all staff and students,5,5,5,5,5
854619,17th March 21,"Comfort is very good, the bed is very soft, very tired;Iron Bridge each room has a sofa, very soft and comfortable.Sound insulation is also very good, very quiet, can not hear the sound of other rooms.The style of the whole furniture looks very comfortable.There are many plants on the opposite side of the window. There will be white flowers in February and March. When the wind blows, the petals fall down.",5,5,5,5,5
1354568,15th March 21,"It’s difficult for me to rate the aspects of the university because due to COVID I haven’t spent a lot of time on campus. As far as I can tell so far the societies are diverse and communicate with freshers very well. Same with the careers service- revaluation emails for student jobs etc. I haven’t personally heard a lot from students union or what they’re up to, but they handled issues with grading due to covid very well.",4.2,4,5,4,4
1054370,15th March 21,"Exeter has been great so far, everyone friendly and beautiful campus",5,5,5,5,5
454141,15th March 21,"Exeter is a good place, but with its limitations. Exeter has lost something about its self that many universities have maintained through COVID. I hope Exeter can rebuild its reputation as a great university in the future",4,3,4,5,5
369,15th March 21,"The uni is great. The staff is so supportive, the campus is amazing, the facilities are well equipped, everyone is very supportive and the societies are really fun",5,5,5,5,5
952949,9th March 21,Have not been able to access a lot of what the uni provides this year but have enjoyed what I have been able to do!,3.8,5,3,3,5
1152486,5th March 21,Happy to choose Exeter :) The faculty is amazing and always available to help. I believe if COVID would not have been there the experience would have been more amazing.,4.4,5,3,4,5
852095,3rd March 21,Havent really been on campus just had online teaching which has not been the greatest,3.2,4,3,3,3
951885,26th February 21,very nice good and convenient. And it is very close to the university.,5,5,5,5,5
1051537,25th February 21,It’s a good university with a nice social life but as fun as you will hope,4.6,5,4,4,5
751172,23rd February 21,The University is great at sorting out career opportunities and the campus is great with very good facilities,4.2,5,4,4,4
1249909,19th February 21,"Very happy to live here, the environment is very good, and close to the city centre. Most important thing is our receptionists are very friendly!!",5,5,5,5,5
1249625,12th February 21,"Exeter is one of a good universities that come with good location and nature. There a lot of experts, good professors and staffs who always support the learners",5,5,5,5,5
1249531,11th February 21,"Good facility and good education background, With excellent teacher group",5,5,5,5,5
549530,6th December 20,"The university campus is really nice, however, it's a disappointing place to study your PhD. The lecturers are unhelpful they just scratching each other backs, regardless of students rights; it's a trap try to avoid it. I am happy that I am not there anymore.",3.2,4,3,3,3
